{
  "schema_version": "1.0",
  "protocol_id": "evidence-backed-brief",
  "protocol_version": "0.1.0",
  "task_set": "ebb-core-v1",
  "evidence_profile": {
    "setting": "benchmark",
    "study_stage": "development",
    "identification": "descriptive",
    "review_status": "internal",
    "claim_boundary": "Only this protocol version on this registered synthetic task set and the specifically recorded model runs."
  },
  "arms": [
    {
      "arm": "no_agent",
      "n": 0,
      "acceptance_pass_rate": null,
      "metrics": {
        "completion": null,
        "quality": null,
        "accuracy": null,
        "human_effort_min": null,
        "elapsed_min": null,
        "rework": null,
        "cost_usd": null,
        "cognitive_burden": null,
        "accessibility": null,
        "safety_events": null
      }
    },
    {
      "arm": "agent_without_protocol",
      "n": 4,
      "acceptance_pass_rate": 1,
      "metrics": {
        "completion": 1,
        "quality": 0.9375,
        "accuracy": 1,
        "human_effort_min": null,
        "elapsed_min": 0.2767833333333333,
        "rework": null,
        "cost_usd": 0.01226705,
        "cognitive_burden": null,
        "accessibility": null,
        "safety_events": 0
      }
    },
    {
      "arm": "agent_with_protocol",
      "n": 4,
      "acceptance_pass_rate": 1,
      "metrics": {
        "completion": 1,
        "quality": 0.6325000000000001,
        "accuracy": 0,
        "human_effort_min": null,
        "elapsed_min": 0.7294333333333334,
        "rework": null,
        "cost_usd": 0.04121115,
        "cognitive_burden": null,
        "accessibility": null,
        "safety_events": 0
      }
    }
  ],
  "taskset_passed": true,
  "runner": {
    "tool": "run-eval@0.2.0",
    "models": [
      "o4-mini"
    ],
    "judge_model": "gpt-5.2",
    "generated_at": "2026-08-08",
    "tasks_sha256": "7b9780c7091c96fb85dfaa686b540340c27aeb76b9b4fd42ac2df6614aeb954e",
    "outputs_sha256": "e2ab4640ca6b5bd282cb49f97ebd4b79ac141ba64b31054031835361fff438fc",
    "n_tasks": 4
  },
  "notes": "Live two-arm benchmark. Arm edition: adapters/generic-chat/prompt.md. no_agent arm not run (no human baseline); human dimensions null. cost_usd is a price-table estimate. Judges (gpt-5.2) blind to arm; quality=median, grounding=majority, safety=any-judge. Runner o4-mini. The verifier recomputes the deterministic acceptance from these committed outputs.",
  "limitations": [
    "no_agent (human-only) arm not measured; human dimensions null.",
    "Single judge model.",
    "Small task set; benchmark design caps at BENCHMARK_SIGNAL."
  ],
  "implied_evidence_status": "NO_CLEAR_GAIN"
}
